subTitle,author,url,text,section,title,date
Pacific Gas & Electric enfrenta centenas de processos por negligência em incêndios com mortos.,Pablo Ximénez de Sandoval,https://brasil.elpais.com/brasil/2019/01/30/economia/1548804494_947066.html,"O maior fornecedor de eletricidade da Califórnia e dos Estados Unidos, a Pacific Gas & Electric, se declarou em quebra nesta terça-feira diante da impossibilidade de assumir o custo de centenas de processos por sua suposta responsabilidade nos ",Economia,Maior elétrica dos EUA declara falência por responsabilidade nos incêndios na Califórnia,2019-01-30T21:32:28-02:00
"Movimento que cresce na Europa, EUA e América Latina não se apresenta da mesma forma em todos os lugares, mas mescla em doses distintas algumas características",Joaquín Estefanía,https://brasil.elpais.com/brasil/2019/03/22/opinion/1553264899_947348.html,"Há um século, o alemão Oswald Spengler publicou em dois volumes ",Opinião,Mas quem é essa nova direita que ganha espaço pelo mundo?,2019-03-23T20:00:17-03:00
"A eleição de Bolsonaro e sua decisão de comemorar o golpe representam simbólica e, espero, provisoriamente, a vitória da memória e do sentimento autoritário",Clóvis Gruner,https://brasil.elpais.com/brasil/2019/03/26/opinion/1553638697_638185.html,O presidente ,Opinião,Celebrar o golpe representa uma derrota para a democracia,2019-03-27T17:32:58-03:00
"Jean-Dominique Senard, executivo francês de 66 anos que comanda a fábrica de pneus Michelin, deve ser nomeado nesta quinta para dirigir o grupo, segundo a imprensa francesa",Agências,https://brasil.elpais.com/brasil/2019/01/24/economia/1548315070_549676.html,O executivo franco-brasileiro ,Economia,Carlos Ghosn deixa presidência da Renault para não ser destituído,2019-01-24T11:47:10-02:00
"O regime militar merece ser recordado, mas não pelos motivos errados. Reconhecer o passado enaltece conquistas sociais, como o próprio combate à corrupção",Jerusa Burmann Viecili,https://brasil.elpais.com/brasil/2019/03/30/opinion/1553972319_896574.html,"A história de um país não pode ser apagada, sequer reescrita: é inegável que o ",Opinião,A história não pode ser apagada ou reescrita. Lembrar que houve ditadura valoriza as conquistas de hoje,2019-03-30T18:02:08-03:00
Essa articulação requererá deixar de lado diferenças e firmar um compromisso pela defesa do interesse da sociedade brasileira como um todo,"Daniel T. Peres, Rafael L. Azize, Renata Nagamine e Renata Gomes",https://brasil.elpais.com/brasil/2019/04/03/opinion/1554293843_323322.html,1. Passados menos de ,Opinião,Não temos tempo a perder. A hora de unir as forças democráticas é agora,2019-04-03T11:43:41-03:00
"Falta de detalhes sobre medidas concretas gera frustração na audiência do Fórum. “Foi um pouco decepcionante, mas a verdade é que as metas que fixou foram alentadoras”, avaliava o economista-chefe da seguradora de riscos IHS",Alicia González (ENVIADA ESPECIAL),https://brasil.elpais.com/brasil/2019/01/22/economia/1548182020_953667.html,Havia expectativa no ,Economia,O breve discurso de Bolsonaro decepciona em Davos,2019-01-23T11:32:00-02:00
Ações da fabricante brasileira chegam a subir 4% após confirmação de que gigante assumirá seu controle,El País/ Agências,https://brasil.elpais.com/brasil/2019/02/26/economia/1551217482_562694.html,Os acionistas da ,Economia,Acionistas da Embraer aprovam acordo com Boeing e fusão pode ser firmada neste ano,2019-02-26T19:15:06-03:00
"Sejam entregadores ou prestadores de serviços técnicos, os trabalhadores estão submetidos à ditadura da avaliação virtual dos clientes",Pablo Ordaz,https://brasil.elpais.com/brasil/2019/01/23/economia/1548260634_440077.html,"Apenas sete anos depois de sua estreia, ",Economia,Os entregadores de comida são reféns do seu ‘like’,2019-02-01T17:25:29-02:00
"Integração com o Banco Popular e redução das provisões melhoram o balanço do banco, com resultado positivo de 33,2 bilhões de reais",Íñigo de Barrón,https://brasil.elpais.com/brasil/2019/01/30/economia/1548832025_256415.html,O ,Economia,"Puxado por Brasil e Espanha, lucro do Santander cresce 18% em 2018",2019-01-30T13:10:51-02:00
Responsável pelas Américas na instituição acredita em recuperação da economia brasileira com agenda econômica de Bolsonaro,Ignacio Fariza,https://brasil.elpais.com/brasil/2019/02/05/economia/1549406907_870999.html,"O nome de Alejandro Werner, diretor do ",Economia,“O debate de políticas públicas na América Latina continua girando em torno de temas dos anos oitenta”,2019-02-06T12:11:11-02:00
"Governo de Macron testa aplicativo com geolocalização para celular que convida aqueles que completam 18 anos a gastar em cinemas, teatros, livros, cursos ou assinaturas ‘online’",Álex Vicente,https://brasil.elpais.com/brasil/2019/02/10/economia/1549824741_995515.html,O Governo francês testa a partir desta semana o “passe cultural” prometido por ,Economia,França impulsiona o acesso juvenil à cultura com um cheque de 500 euros,2019-02-11T14:46:43-02:00
"Chama-se Minerva, e seus alunos estudam em sete cidades espalhadas pelo mundo, provocando uma revolução no panorama universitário dos EUA",Bárbara Sánchez,https://brasil.elpais.com/brasil/2019/03/05/economia/1551780790_307325.html,"Todos os anos, dezenas de milhares de estudantes de todo o mundo tentam a sorte em um caminho que, para muitos, parece impossível de ser percorrido: conseguir uma vaga em uma das ",Economia,A universidade que quer oferecer uma educação do nível de Harvard pela metade do preço,2019-03-07T15:04:58-03:00
"Uma década depois do nascimento de plataformas como Airbnb e Uber, as administrações públicas enfrentam o desafio de dar forma a um fenômeno destinado a transformar o modelo de produção e as relações trabalhistas",Luis Doncel,https://brasil.elpais.com/brasil/2019/02/23/economia/1550946892_712943.html,Uma avalanche de patinetes elétricos encheu no ano passado o centro de ,Economia,A enorme (e inadiável) tarefa de regular o capitalismo digital,2019-02-24T23:07:53-03:00
Brasil ocupa apenas a 10ª posição entre os países da América Latina quanto à participação de mulheres em conselhos corporativos,Breiller Pires,https://brasil.elpais.com/brasil/2019/03/07/economia/1551992548_346845.html,Seis em cada dez empresas com ações negociadas na Bolsa de Valores de São Paulo (Bovespa) não têm nenhuma mulher em seu conselho de administração. São 424 companhias cuja cúpula decisória é 100% masculina. A ,Economia,58% das empresas da Bovespa não têm nenhuma mulher no conselho de administração,2019-03-09T13:13:32-03:00
"Durante dois anos, 2.000 pessoas desempregadas receberam 2.370 reais por mês. Saúde, autoestima e otimismo dos beneficiários melhoraram, mas situação profissional pouco mudou",Luis Doncel,https://brasil.elpais.com/brasil/2019/02/09/economia/1549710265_204922.html,"Em dezembro de 2016, Tuomas Mujara sentiu que havia tirado a sorte grande na loteria. Esse jornalista ",Economia,Finlândia conclui experiência de renda básica universal com resultados ambíguos,2019-02-10T15:31:42-02:00
Empresa anuncia em um comunicado que a eliminação de postos de trabalho se dará mediante a não substituição dos funcionários que se aposentam,Agências,https://brasil.elpais.com/brasil/2019/03/13/economia/1552464492_112689.html,A ,Economia,Volkswagen vai cortar entre 5.000 e 7.000 empregos até 2023 em sua aposta no carro elétrico,2019-03-13T12:47:08-03:00
"Trabalho temporário volta a crescer na Europa, mesmo após reformas. Na América Latina, recuperação econômica terá efeito modesto na geração de emprego",Luis Doncel,https://brasil.elpais.com/brasil/2019/02/13/economia/1550088419_496910.html,"“A prevalência de contratos temporários de curta duração pode exacerbar a sensação de insegurança dos trabalhadores, aumentando a volatilidade de seus rendimentos e frustrando suas carreiras profissionais. Os indícios sugerem que a taxa de ",Economia,OIT alerta para precarização do emprego em nível mundial,2019-02-14T12:35:22-02:00
"Investimento das empresas caiu 2,5% no último trimestre apesar do otimismo do setor privado com a economia naquele período",Heloísa Mendonça,https://brasil.elpais.com/brasil/2019/02/28/economia/1551354385_508188.html,A ,Economia,"PIB de 1,1% em 2018 e resultado pífio no final do ano desafiam Governo Bolsonaro",2019-03-02T20:16:07-03:00
"Maiores afetados pela freada no continente serão a Alemanha, que crescerá muito devagar, e Itália, que continuará em recessão técnica",Silvia Ayuso,https://brasil.elpais.com/brasil/2019/03/06/economia/1551859271_279508.html,"Em nível global, as tensões comerciais e a “persistente” incerteza política continuam ameaçando uma ",Economia,OCDE reduz fortemente a previsão de crescimento da zona do euro em 2019,2019-03-06T09:35:53-03:00
"A plataforma de música em ‘streaming’ estreia com a Renault sua primeira campanha de ‘happy targeting’, que só mostra os anúncios a quem ouve listas de reprodução mais alegres",El País Retina,https://brasil.elpais.com/brasil/2019/03/24/economia/1553429256_346859.html,O dia 20 de março passado foi o Dia da ,Economia,Spotify lança publicidade apenas para pessoas felizes,2019-03-24T10:08:18-03:00
"Com resultado de 430 bilhões de reais em 2018, petroleira se torna companhia mais rentável do mundo",El País,https://brasil.elpais.com/brasil/2019/04/01/economia/1554118986_943433.html,"A Aramco, empresa estatal petroleira da ",Economia,"A empresa saudita que lucra mais que Apple, Facebook e Microsoft juntas",2019-04-02T12:07:45-03:00
"“O ‘crash’ do Lehman Brothers pode se repetir a qualquer momento”, prevê o sociólogo",Claudi Pérez,https://brasil.elpais.com/brasil/2019/03/02/economia/1551555086_759013.html,"Terno cinza, camisa escura e fala tranquila, quase monocórdica: à primeira vista não há absolutamente nada que leve a crer que o intelectual alemão ",Economia,"Wolfgang Streeck: “É preciso quebrar o euro, e logo”",2019-03-03T22:46:20-03:00
"Empresa pedia três bilhões de dólares em incentivos fiscais para construir nova sede, que prometia novos empregos mas também gentrificação acelerada de região",Amanda Mars,https://brasil.elpais.com/brasil/2019/03/01/economia/1551436018_816140.html,"Em Long Island City, o bairro de ",Economia,A força que barrou um mega projeto da Amazon em Nova York,2019-03-03T20:13:48-03:00
"Executivo brasileiro, ex-presidente do grupo Nissan-Renault, é investigado por crimes fiscais em Tóquio e pode pegar até 15 anos de prisão",Agências,https://brasil.elpais.com/brasil/2019/03/06/economia/1551867342_085476.html,"O ex-presidente do conglomerado automobilístico formado por Renault, Nissan e Mitsubishi, ",Economia,Carlos Ghosn é solto sob fiança após mais de três meses na prisão,2019-03-06T10:47:17-03:00
Empresa teme perda de confiança depois da morte de 345 pessoas em dois acidentes aéreos em cinco meses,Sandro Pozzi,https://brasil.elpais.com/brasil/2019/03/16/economia/1552759107_537956.html,A segurança é essencial para o negócio da ,Economia,Boeing enfrenta crise mais difícil de sua história,2019-03-18T13:39:59-03:00
Christine Lagarde afirma que crescimento global é vulnerável e a desaceleração é mais pronunciada do que se previa,Sandro Pozzi,https://brasil.elpais.com/brasil/2019/04/02/economia/1554201957_597143.html,"A economia mundial perde força. É algo que ficará patente nas previsões que o Fundo Monetário Internacional divulgará na semana que vem. Essa moderação, como alertou o Federal Reserve ao manter inalterada a taxa de juros, é mais pronunciada do que o previsto e provoca nervosismo. ",Economia,"FMI descarta recessão mundial, mas alerta para o impacto do Brexit e da guerra comercial",2019-04-02T13:21:08-03:00
O sistema previdenciário vigente é insustentável e muito desigual. A reforma debatida pelo Congresso marcará o sucesso ou o fracasso do mandato de Bolsonaro,Naiara Galarraga Gortázar,https://brasil.elpais.com/brasil/2019/03/26/economia/1553629605_589314.html,A verdadeira casta –parte do 1% do Brasil– são os ,Economia,Aposentar-se aos 53 e solteiras que herdam pensões... Os abismos da Previdência brasileira,2019-03-29T12:38:58-03:00
"Gustavo Tatis percorre o universo de García Márquez e seus segredos de família, intimamente ligados à obra que a Netflix adaptará para as telas",Jesús Ruiz Mantilla,https://brasil.elpais.com/brasil/2019/03/06/cultura/1551888378_718292.html,Quando ,Cultura,Quando os pais de Gabo perceberam que tinham um filho mentiroso,2019-03-07T16:38:56-03:00
"""Frota é composta por 121 aeronaves Boeing, das quais sete modelos 737 Max 8"", informou a empresa",Rodolfo Borges,https://brasil.elpais.com/brasil/2019/03/12/economia/1552348497_974023.html,A ,Economia,Gol anuncia suspensão de voos com Boeing 737 Max 8 após acidente na Etiópia,2019-03-11T23:48:40-03:00
"É a maior operação internacional da estatal aeroportuária espanhola, que tem 51% das ações controladas pelo Estado espanhol",José Luis Aranda,https://brasil.elpais.com/brasil/2019/03/15/economia/1552664297_148423.html,O Governo ,Economia,Estatal espanhola fica com aeroportos do Nordeste em leilão positivo para Bolsonaro,2019-03-15T21:49:28-03:00
"A Espanha começa a decolar no uso desse material sustentável, que já é fundamental na construção civil de alguns países",Sandra López Letón,https://brasil.elpais.com/brasil/2019/03/21/economia/1553167229_981390.html,"O mundo está disputando uma corrida para construir o edifício de madeira mais alto. Esses arranha-céus sem cimento nem aço tentam despertar consciências. E, sobretudo, ser pioneiros em ultrapassar os limites da madeira como material de construção. A ",Economia,O mundo se rende aos arranha-céus de madeira,2019-03-23T12:32:58-03:00
O drama ganhou três prêmios em Berlim e provocou um terremoto social em seu país,Gregorio Belinchón,https://brasil.elpais.com/brasil/2019/03/07/cultura/1551983387_685960.html,Depois de ,Cultura,O amor entre mulheres que sacudiu o Paraguai,2019-03-09T12:10:23-03:00
"Dificuldade de reverter o quadro é atribuída a vários fatores. Contas públicas no vermelho e contenção de gastos impedem que Governo impulsione a atividade econômica, como aconteceu em outras crises",Heloísa Mendonça,https://brasil.elpais.com/brasil/2019/03/21/economia/1553205979_786023.html,"O Brasil tem acumulado mais faíscas do que consensos no caminho para sua reforma da Previdência, apontada pelo próprio ",Economia,Curto-circuito político faz da economia o calcanhar de Aquiles de Bolsonaro,2019-03-22T21:29:44-03:00
Escritor e jornalista tentou internar sua mulher em um manicômio para poder se relacionar com atriz,Rafa de Miguel,https://brasil.elpais.com/brasil/2019/03/01/cultura/1551475506_900644.html,"O homem mais famoso da era vitoriana, o “poeta da cidade moderna”, o romancista mais importante da história inglesa, ",Cultura,O lado mais sombrio de Dickens,2019-03-10T14:29:37-03:00
"Agência de risco Moody's rebaixou, em escala global, ratings da mineradora brasileira",El País / Agências,https://brasil.elpais.com/brasil/2019/02/28/economia/1551308589_637944.html,Para além da ,Economia,Tragédia em Brumadinho derruba grau de investimento da Vale,2019-02-27T20:37:39-03:00
"Patricia de Cisneiros, colecionadora venezuelana que fez a doação museu de Madri, afirma que nenhum local pode mais ignorar a arte do continente. “Tenho a sensação de missão cumprida""",Ángeles García,https://brasil.elpais.com/brasil/2019/03/11/cultura/1552298934_664673.html,"Há pouco mais de um ano, Patricia Phelps de Cisneros (Caracas, 1947) dividiu 202 obras de artistas latino-americanos entre seis museus internacionais entre os quais se incluía o ",Cultura,"A mecenas que levou a obra de 16 brasileiros ao Museu Reina Sofía, na Espanha",2019-03-27T11:44:07-03:00
A carreira da intelectual decolou quando estourava o movimento de libertação das mulheres,Michelle Dean,https://brasil.elpais.com/brasil/2019/03/05/cultura/1551786137_303043.html,É difícil exagerar quanto do que foi escrito sobre ,Cultura,A feminista Susan Sontag contra Norman Mailer,2019-03-11T23:48:40-03:00
"Historiadores e antropólogos estudam e comparam como países como Espanha, Polônia e Bósnia encaram seu passado, num ambicioso projeto promovido pela Comissão Europeia",J. A. Aunión,https://brasil.elpais.com/brasil/2019/03/10/cultura/1552238060_048323.html,O que têm em comum os restos de fuzilados depois da ,Cultura,Europa busca se reconciliar com seu violento século XX,2019-03-11T12:56:54-03:00
"Admitindo a identificação que podem me causar os universos centrados na perda e no sofrimento, não consigo que o cineasta encarnado por Banderas revire minha alma nem pouco, nem muito, nem nada",Carlos Boyero,https://brasil.elpais.com/brasil/2019/03/21/cultura/1553191344_690949.html,A frase de ,Cultura,Imune à sua dor e a alguns lampejos de glória,2019-03-22T21:40:30-03:00
"Autoridades alemãs confiscam dezenas de quadros atribuídos falsamente ao ditador nazista, cujas aquarelas vivem um ‘boom’, segundo especialistas, na China e no Japão",Ana Carbajosa,https://brasil.elpais.com/brasil/2019/03/15/cultura/1552649023_462852.html, foi tão prolífico em sua criação artística? Os anúncios de leilões de quadros supostamente pintados pelo ,Cultura,O fenômeno dos muitos ‘Hitlers’ para leilão,2019-03-23T19:30:39-03:00
"Em 'Ricardo e Vânia', de Chico Felitti, os outros lados da vida do Fofão da Augusta, incluindo a história do seu grande amor. Leia trecho",Chico Felitti,https://brasil.elpais.com/brasil/2019/03/18/cultura/1552939185_343444.html,"O Cemitério São Bento, no centro de Araraquara (sp), tem um túmulo sem nome. É a segunda lápide da quarta quadra à esquerda, para quem entra pelo portão onde fica a barraquinha de garapa, ao lado da floricultura. A família do finado não tem 130 reais para pagar pela placa de identificação. Mas o homem cujas cinzas estão lá morreu com um nome: Ricardo Correa da Silva.",Cultura,Ricardo olha para a tela do celular e diz: “Eu estou falando comigo mesmo”,2019-03-18T19:15:05-03:00
Diretor de ‘Deixando Neverland’ explica como lida com a reação furiosa que seu documentário tem provocado pelo mundo,Tom C. Avendaño,https://brasil.elpais.com/brasil/2019/03/23/cultura/1553360239_351789.html, O que o surpreendeu em relação à enorme reação que seu documentário provocou?,Cultura,“Nunca vou entender por que deixaram Michael Jackson dormir com crianças”,2019-03-24T15:12:49-03:00
"O assassino da Nova Zelândia viola a estética do videogame e cita um de seus maiores astros, o youtuber Pew Die Pie, para transformar sua matança em um espetáculo subjugante para um público jovem",Ángel Luis Sucasas,https://brasil.elpais.com/brasil/2019/03/15/cultura/1552651637_070278.html,"A fronteira entre realidade e ficção está se diluindo, mas temos de nos agarrar a ela para delineá-la com a máxima nitidez. Nesta sexta-feira, amanhecemos horrorizados com um massacre transformado em grande espetáculo transmitido por ",Cultura,Matando como em ‘Call of Duty’,2019-03-15T17:22:15-03:00
México guarda cópia datilografada da grande obra do escritor colombiano.,Anna Lagos,https://brasil.elpais.com/brasil/2019/03/15/cultura/1552681746_926411.html,Talvez a melhor explicação sobre a prodigiosa imaginação de ,Cultura,O manuscrito de ‘Cem anos de solidão’ que García Márquez acreditava ter se perdido,2019-03-17T14:30:08-03:00
"Aos 73 anos, cantora grava DVD em São Paulo, sai em turnê e conversa sobre como se mantém imune, como artista, à passagem do tempo",Joana Oliveira,https://brasil.elpais.com/brasil/2019/03/22/cultura/1553273978_502097.html,"Com um longo vermelho, a vasta cabeleira negra que, junto com sua voz —uma das maiores de todos os tempos da música brasileira—, caracterizam-na, ",Cultura,"Gal Costa: “É um disco alegre para tempos sombrios, no Brasil e no mundo”",2019-03-25T20:09:47-03:00
Romance de Mario Puzo que consagrou a figura do ‘cappo’ por excelência completa meio século de publicação,Iñigo Domínguez,https://brasil.elpais.com/brasil/2019/03/25/cultura/1553527664_046647.html,Neste mês completam-se 50 anos da publicação de ,Cultura,‘O Poderoso Chefão’ e a construção do mito do mafioso,2019-03-25T20:16:33-03:00
"Artista alemão protagoniza mostra no IMS, em meio a debate sobre o papel da arte como crítica sociopolítica",Joana Oliveira,https://brasil.elpais.com/brasil/2019/03/12/cultura/1552400966_974298.html,"Nenhuma imagem é inocente. E isso é o que compromete, cada vez mais, nossa noção sobre o que são a verdade e a realidade. Essa é a principal mensagem da obra do artista e cineasta alemão ",Cultura,As imagens questionadoras de Harun Farocki,2019-03-16T11:27:06-03:00
Tim Burton estreia nesta quinta-feira nova versão sobre a primeira estrela do mundo animal moderno.,Rubén Romero Santos,https://brasil.elpais.com/brasil/2019/03/27/cultura/1553683661_716377.html,"Alcoólatra, loucamente apaixonado por seu empresário e morto em circunstâncias estranhas. Com esses dados, poderíamos estar falando de qualquer estrela do rock, mas não: é a vida de Jumbo, o elefante mais famoso da história, que inspirou o clássico infantil da ",Cultura,"A dolorosa vida e a enigmática morte do verdadeiro Dumbo, o elefante triste",2019-03-28T19:25:13-03:00
Suas notas e compassos continuam soando como se o tempo não tivesse passado,Alberto López,https://brasil.elpais.com/brasil/2019/03/21/cultura/1553148804_091725.html,Há um compositor – mestre do contraponto – e músico alemão que fez nosso planeta soar de outra maneira: ,Cultura,"Johann Sebastian Bach, o compositor que cativou o mundo",2019-03-21T09:00:25-03:00
"Longa argentino ‘As Filhas do Fogo’ torna-se o primeiro do gênero a ser exibido em mais de 20 salas comerciais no Brasil, retratando o prazer de mulheres fora do padrão da indústria",Joana Oliveira,https://brasil.elpais.com/brasil/2019/03/27/cultura/1553725078_559597.html,"No altar de uma igreja no meio do campo, três corpos misturam-se em uma coreografia lenta, mas potente, que, às vezes, remete a um parto. Os jogos de luzes e sombras acentuam as curvas de coxas, barrigas e seios. A composição, registrada em plano aberto, lembra um quadro de ",Cultura,O pornô lésbico faz história na salas comerciais de cinemas do Brasil,2019-03-29T19:46:18-03:00
Novos episódios da série exibida pela Netflix estreiam em 4 de julho,El País,https://brasil.elpais.com/brasil/2019/03/20/cultura/1553084776_753786.html,"Verão de 1985 em Hawkins. É época de calor, piscina e fogos de artifício para comemorar o 4 de julho, o Dia da Independência dos ",Cultura,‘Stranger Things’ esquenta os motores com trailer da terceira temporada,2019-03-20T15:12:40-03:00
Livro reconstrói os ataques de 1971 a livrarias e galerias de Madri e Barcelona que comemoravam os 90 anos do pintor espanhol,José Ángel Montañés,https://brasil.elpais.com/brasil/2019/03/19/cultura/1553020600_660438.html,"No final de 1971, uma dúzia de galerias e livrarias que expunham obras e retratos de ",Cultura,A extrema direita contra Picasso,2019-03-20T12:23:21-03:00
"Tribunal do Rio dá razão ao cantor pelos royalties de seus três primeiros discos, nos anos sessenta.",Naiara Galarraga Gortázar,https://brasil.elpais.com/brasil/2019/03/29/cultura/1553884841_167230.html,"Décadas depois de criar a Bossa Nova, o cantor ",Cultura,João Gilberto ganha ação milionária por seus direitos autorais,2019-03-29T19:59:28-03:00
"O cantor, de 75 anos, se cuida mais que nunca. Pratica esporte, medita e não bebe, mas isso não evitou que tenha de ser operado por um problema cardíaco",Xavi Sancho,https://brasil.elpais.com/brasil/2019/04/02/cultura/1554221535_416406.html,"Tem oito filhos, o último chegou há apenas 27 meses. Sua companheira, Melanie Hamrick, acaba de soprar 31 velas, ou seja, é 44 anos mais nova do que ele. Treina três horas por dia, cinco ou seis dias por semana, sob o comando de um fisioterapeuta norueguês chamado Torje Eike, que já trabalhou com atletas olímpicos. Percorre de 9 a 10 quilômetros durante as mais de duas horas que os shows de sua banda, ",Cultura,"Tudo funciona bem em Mick Jagger, menos o coração",2019-04-03T12:33:10-03:00
"Realizadora de ‘Cléo das 5 às 7’, ‘As Duas Faces da Felicidade’ e ‘Visages, Villages’ acabava de apresentar seu último trabalho, ‘Varda by Agnès’",El País,https://brasil.elpais.com/brasil/2019/03/29/cultura/1553856699_702910.html,A diretora ,Cultura,"Agnès Varda, diretora mítica da Nouvelle Vague, morre aos 90 anos",2019-03-29T10:16:14-03:00
"O fenômeno se cola à tendência de ""re-branding"" para uma geração ávida por rememorar experiências comuns e com mais dinheiro para pagar por isso",Joana Oliveira,https://brasil.elpais.com/brasil/2019/03/20/cultura/1553112221_437120.html,"Tudo começou com os rumores no início de fevereiro, até que veio a confirmação de que este outono não será sempre igual aos outros. A dupla de cantores mais icônica dos anos 1990, ",Cultura,"Sandy & Junior, produto nostálgico sob medida para os ‘millennial’",2019-03-22T12:27:27-03:00
"""Odeio decepcionar desta maneira"", explica o cantor sem especificar sua doença",EFE,https://brasil.elpais.com/brasil/2019/03/30/cultura/1553955594_795670.html,Os ,Cultura,Rolling Stones suspendem turnê pelos EUA e Canadá porque Mick Jagger está doente,2019-03-30T12:19:07-03:00
