subTitle,author,url,text,section,title,date
"Aproveitamos a recente estreia de 'Dumbo' para pedir esse ranking a Rubén Romero, crítico de cinema, professor de Comunicação Audiovisual da Universidade Carlos III e especialista no cinema do diretor que gosta de jovens estranhos",Rubén Romero Santos,https://brasil.elpais.com/brasil/2019/03/28/cultura/1553773473_512189.html,No prólogo de ,Cultura,"Todos os filmes de Tim Burton, do pior ao melhor",2019-03-31T17:15:15-03:00
"Há dez anos, uma total desconhecida tornou-se, da noite para o dia, a mulher mais famosa do mundo. É assim que ela vive hoje, depois de conhecer a glória e a riqueza, mas também a obscuridade",Guillermo Alonso,https://brasil.elpais.com/brasil/2019/04/04/cultura/1554380845_480636.html,"Uma mulher de cabelo embaraçado e grisalho, sobrancelhas grossas e um vestido não muito feliz, como de madrinha de comunhão, caminha para o palco vazio do Clyde Auditorium, em Glasgow. Do outro lado, um painel de quatro jurados (entre eles o temido Simon Cowell) e um público disposto a aplaudir ou vaiar de acordo com o espetáculo. A mulher se apresenta no ",Cultura,"O que a fama fez com Susan Boyle, a mulher que revolucionou a música, a televisão e as redes sociais",2019-04-04T16:13:54-03:00
Parlamento continental aprova regra destinada a proteger criadores contra gigantes como Google.,Tommaso Koch,https://brasil.elpais.com/brasil/2019/03/26/cultura/1553596416_484654.html,A reforma dos direitos autorais na ,Cultura,"Reforma europeia garante direitos de autor na Internet, mas levanta receios sobre liberdade",2019-03-26T21:01:49-03:00
Promotor especial Robert S. Mueller deixa em aberto a possibilidade do presidente ter cometido o crime de obstrução da Justiça durante apuração de ingerência de Moscou nas eleições presidenciais de 2016,Amanda Mars,https://brasil.elpais.com/brasil/2019/03/24/internacional/1553448280_352863.html,O promotor especial ,Internacional,Investigação não encontra provas de conspiração entre Trump e a Rússia,2019-03-24T18:55:58-03:00
"Ex-presidente conversa sobre seu livro ‘La Batalla por la Paz’, um relato repleto de detalhes, casos e confidências sobre as negociações com as FARC",Javier Moreno,https://brasil.elpais.com/brasil/2019/03/22/internacional/1553283034_089639.html,"A cena, sob qualquer medida, é extraordinária. Um presidente, com dois de seus colaboradores, na biblioteca da Casa de Nariño, sua residência oficial. Fora, a família e os convidados se abraçam e choram. Dentro, ",Internacional,“Chamar-me de traidor foi uma estratégia muito bem montada para minar minha liderança”,2019-03-23T15:32:43-03:00
Netflix divulga as primeiras imagens da terceira temporada da série espanhola,El País,https://brasil.elpais.com/brasil/2019/04/01/cultura/1554127401_450967.html,"""As férias acabam em julho"". Assim a ",Cultura,Nova temporada de ‘La Casa de Papel’ já tem data de estreia,2019-04-01T14:40:37-03:00
"O esforço de imaginação dos produtores, especificamente da Disney, para continuar alimentando seus cofres alquebrados encontrou faz tempo uma ideia rentável",Carlos Boyero,https://brasil.elpais.com/brasil/2019/03/28/cultura/1553781394_105864.html,Imagino que os executivos e estrategistas de ,Cultura,"‘Dumbo’, a animação em carne e osso",2019-03-29T14:45:11-03:00
"Luis López, médico espanhol em Moçambique, alerta para o risco de surtos de cólera e tifo nas próximas semanas, depois da passagem do ciclone Idai",José Naranjo,https://brasil.elpais.com/brasil/2019/03/22/internacional/1553267887_733612.html,"“Esta é uma catástrofe humanitária completa, e a cifra oficial de mortos vai aumentar à medida que pudermos acessar as zonas aonde não se consegue chegar agora.” Assim o médico espanhol Luis López Rivero resume as consequências da passagem do ",Internacional,"“Não há água potável, eletricidade, escolas nem saúde; é uma autêntica catástrofe”",2019-03-26T17:47:54-03:00
Aterrissagem das aeronaves ocorre depois de Maduro dizer que havia reforçado sua segurança,Jacobo García,https://brasil.elpais.com/brasil/2019/03/24/internacional/1553458236_783517.html,"A chegada de dois aviões militares russos ao aeroporto de Maiquetía, em Caracas, neste sábado à tarde, desencadeou todos os tipos de suspeitas sobre os papéis que irá desempenhar a centena de militares que viajava neles. De acordo com fontes da Embaixada da Rússia na Venezuela, citadas pela agência de notícias oficial russa Sputnik, as aeronaves transportavam equipamentos e pessoal para atender a vários acordos militares entre os dois países. ""Eles não têm nada de misterioso"", disseram as fontes referindo-se aos voos, que chegaram à ",Internacional,Dois aviões russos chegam à Venezuela com uma centena de militares,2019-03-24T20:48:02-03:00
"Holanda e França decidem devolver obras de arte aos seus lugares de origem, mas a questão se estende a países de quase todo o continente",Héctor Llanos Martínez,https://brasil.elpais.com/brasil/2019/03/14/cultura/1552575802_167574.html,Passear pelo ,Cultura,O que aconteceria se os museus europeus tivessem que devolver a arte colonial espoliada?,2019-03-25T14:18:43-03:00
"Março é uma época amarga para Eric Clapton. No final desse mês, em 1991, o músico perdeu seu filho de quatro anos num acidente no quarto de um hotel. Pouco tempo depois, dedicou-lhe uma dolorosa melodia. Esta é a história.",Sara Navas,https://brasil.elpais.com/brasil/2019/03/26/cultura/1553619196_547382.html,"Quase uma década após a tragédia, Lory del Santo ainda não havia escutado ",Cultura,‘Tears in Heaven’: a tragédia que inspirou uma das canções mais comoventes da história,2019-03-30T14:24:02-03:00
"""Por anos denunciei a proteção dada ao terrorista"", celebrou Bolsonaro no Twitter",Lorena Pacho,https://brasil.elpais.com/brasil/2019/03/25/internacional/1553541637_936838.html,O ex-terrorista italiano de extrema esquerda ,Internacional,"Battisti admite participação em assassinatos, mas se recusa a delatar",2019-03-25T17:23:42-03:00
A Casa Branca contradiz o Departamento do Tesouro e justifica a decisão dizendo que “o presidente Trump simpatiza com o líder” norte-coreano,Yolanda Monge,https://brasil.elpais.com/brasil/2019/03/22/internacional/1553282913_430085.html,"Com um simples tuíte, o presidente dos ",Internacional,"De surpresa, Trump revoga as últimas sanções impostas à Coreia do Norte",2019-03-23T16:37:54-03:00
Companhia Antonio Gades volta a apresentar no país 'Fuenteovejuna' e 'Carmen' após 31 anos.,Joana Oliveira,https://brasil.elpais.com/brasil/2019/04/03/cultura/1554316538_562756.html,"""Se fiz algo para renovar o flamenco é porque fui para trás em vez de ir para a frente"", costumava dizer o célebre coreógrafo Antonio Gades, principal expoente da dança espanhola. Quinze anos depois de sua morte, a companhia que leva seu nome mantém esse espírito: os mais de 20 bailarinos que se apresentam nos palcos brasileiros com os espetáculos ",Cultura,O flamenco com a luzes e sombras de Goya toma os palcos do Brasil,2019-04-03T21:26:07-03:00
O autor de 'El Jarama' e 'Alfanhuí' e de uma ampla e original obra ensaística ganhou o Prêmio Cervantes em 2004,José Andrés Rojo,https://brasil.elpais.com/brasil/2019/04/01/cultura/1554109097_331968.html," morreu em Madri aos 91 anos. Pouco disposto a falar de si mesmo e de sua obra, intitulou ",Cultura,"Morre Rafael Sánchez Ferlosio, mestre singular das letras espanholas, aos 91 anos",2019-04-01T12:23:38-03:00
"Mais de mil venezuelanos que desertaram há um mês aguardam em casas, hotéis e albergues sem esconder seu mal-estar quanto às condições em que vivem",S.T,https://brasil.elpais.com/brasil/2019/03/23/internacional/1553364735_261696.html,"Foram recebidos por três presidentes estrangeiros como heróis da pátria que tinham conseguido romper o cerco chavista em 23 de fevereiro, ao fugir para a ",Internacional,O incerto futuro dos militares que desertaram na Venezuela,2019-03-24T19:09:33-03:00
"“Isso é algo que deveria ter sido feito há muitas décadas”, afirmou o presidente dos EUA na Casa Branca.",Pablo Guimón,https://brasil.elpais.com/brasil/2019/03/25/internacional/1553531080_402312.html,"O presidente dos Estados Unidos, ",Internacional,Trump reconhece soberania de Israel sobre as Colinas de Golã,2019-03-25T16:27:56-03:00
Parlamento britânico rejeita todas as opções alternativas ao plano de saída do primeiro ministro,Rafa de Miguel,https://brasil.elpais.com/brasil/2019/03/27/internacional/1553708320_421999.html," usou a última bala na Câmara, depois que, nas últimas horas, diferentes ministros e companheiros de partido deram a entender que o único caminho para que ela conseguisse que seu plano para o ",Internacional,Theresa May oferece sua demissão para salvar seu plano do Brexit,2019-03-27T20:28:35-03:00
"Em carta, Obrador diz que essa é a única forma possível de obter reconciliação plena entre os países.",Javier Lafuente,https://brasil.elpais.com/brasil/2019/03/25/internacional/1553539019_249884.html,"O presidente do México, ",Internacional,Presidente do México pede ao rei espanhol que se desculpe por abusos da colonização,2019-03-25T19:42:44-03:00
"Comunidade escolar da Flórida, nos EUA, pede mais recursos para programas de saúde mental",Antonia Laborde,https://brasil.elpais.com/brasil/2019/03/26/internacional/1553626056_197921.html,Há dias circula no Twitter a hashtag #17plus2 (17 mais dois). Ela faz referência às 17 vítimas fatais do ,Internacional,Dois sobreviventes do massacre de Parkland se suicidam na mesma semana,2019-03-26T22:27:34-03:00
"Em entrevista ao EL PAÍS, o ideólogo da extrema direita diz que o vice-primeiro-ministro italiano e o premiê húngaro Viktor Orbán são os políticos mais importantes da Europa atualmente",Daniel Verdú,https://brasil.elpais.com/brasil/2019/03/24/internacional/1553454729_290547.html," (Norfolk, 1953), ex-assessor estratégico do presidente dos Estados Unidos, ",Internacional,Steve Bannon: “Bolsonaro e Salvini são os melhores representantes do movimento nacional-populista”,2019-03-25T12:19:12-03:00
Lucetta Scaraffia e equipe saem apontando retorno à cultura da “mulher obediente” dentro da Igreja.,Daniel Verdú,https://brasil.elpais.com/brasil/2019/03/26/internacional/1553599594_604218.html,O ,Internacional,Diretora do suplemento feminino de jornal do Vaticano se demite por tentativas de calá-lo,2019-03-26T22:07:58-03:00
Diretora de departamento de saúde da OMS diz que o aquecimento global reduz a expectativa de vida,Emilio de Benito,https://brasil.elpais.com/brasil/2019/03/26/internacional/1553626291_625535.html,"A espanhola María Neira (La Felguera, Langreo, Astúrias, 1960) está há 13 anos à frente do Departamento de Saúde Pública e Meio Ambiente da ",Internacional,“Esqueceram-se dos 70.000 mortos da onda de calor de 2003”,2019-03-27T15:04:51-03:00
Parlamento britânico volta a votar contra o plano da primeira-ministra para a saída da UE,Agências,https://brasil.elpais.com/brasil/2019/03/29/internacional/1553874053_923847.html,O Parlamento britânico rejeitou nesta sexta-feira ,Internacional,"Após terceira rejeição ao plano de May para o Brexit, o que pode acontecer?",2019-03-29T17:18:05-03:00
Consultoria Mercer considera capital uruguaia a cidade com melhor qualidade de vida na região para empregados de multinacionais,Magdalena Martínez,https://brasil.elpais.com/brasil/2019/03/25/internacional/1553539191_185403.html,Dois estudos apontaram nestes dias a capital uruguaia como a melhor da ,Internacional,O charme decadente que coloca Montevidéu no topo das cidades latino-americanas,2019-03-28T12:14:34-03:00
Exército concentra tropas e limita as atividades civis na fronteira do enclave palestino,Juan Carlos Sanz,https://brasil.elpais.com/brasil/2019/03/26/internacional/1553587140_841439.html,"O anúncio de cessar-fogo com mediação egípcia, divulgado na noite de segunda-feira pelo ",Internacional,Israel ataca Gaza e o Hamas lança foguetes apesar do anúncio de cessar-fogo,2019-03-26T10:12:36-03:00
Câmara dos Representantes não consegue os dois terços de votos necessários para revogar a declaração de emergência do presidente para construção do muro com o México,Yolanda Monge,https://brasil.elpais.com/brasil/2019/03/26/internacional/1553633660_869823.html," parece não parar de encadear vitórias. A Câmara dos Representantes fracassou nesta terça-feira em sua tentativa de reverter o veto do presidente, o que deixa intacta a ",Internacional,Fracasso democrata para derrubar veto de Trump no Congresso,2019-03-27T17:28:07-03:00
Fraqueza da oposição facilita um longo período de governo do líder conservador Shinzo Abe,Andrea Rizzi,https://brasil.elpais.com/brasil/2019/03/22/internacional/1553257299_062869.html,"As quatro paredes da principal sala de reuniões dos dirigentes do Partido Liberal Democrático do Japão (PLD), em sua sede em Tóquio, exibem os retratos de todos os seus líderes. O partido ostenta o poder no país de forma quase ininterrupta desde 1955, com lideranças geralmente muito breves, de modo que as paredes estão já quase repletas de imagens. No entanto, faz mais de seis anos que não é necessário pendurar nenhuma. ",Internacional,A exceção japonesa ao terremoto político das democracias avançadas,2019-03-27T23:16:13-03:00
Pobreza cresce mais de 6 pontos em 2018 e chega a 32%.,Enric González,https://brasil.elpais.com/brasil/2019/03/28/internacional/1553792656_629543.html," oferece a mesma coisa todos os dias: sangue, suor e lágrimas. “Vocês têm que aguentar, eu estou convencido de que aguento”, disse ao Congresso em 1º de março. E o sofrimento aumenta. Durante o segundo semestre de 2018, 32% da população urbana argentina estava abaixo da linha da pobreza. Foi um aumento de quase cinco pontos percentuais com relação ao primeiro semestre, e de mais de seis pontos em comparação aos 25,7% de 2017. Estes 32% de pobres na população argentina representam um retorno ao nível que Macri diz ter herdado de ",Internacional,Macri perde luta contra a pobreza em ano de eleição na Argentina,2019-03-29T18:21:27-03:00
Presidente dos EUA recebe a mulher de Guaidó e sobe o tom de sua ameaça a Maduro:,Amanda Mars,https://brasil.elpais.com/brasil/2019/03/27/internacional/1553705686_334328.html," recebeu Fabiana Rosales, mulher de Juan Guaidó, nesta quarta-feira no Salão Oval da Casa Branca e salientou seu apoio ao líder da Assembleia Nacional, mais de dois meses depois de ele ser ",Internacional,Trump: “A Rússia tem que ir embora da Venezuela”,2019-03-27T18:11:44-03:00
Presidente adota as medidas após os graves blecautes que deixaram o país sem água e luz no último dia 7,Alonso Moleiro,https://brasil.elpais.com/brasil/2019/04/01/internacional/1554084795_313068.html," anunciou neste domingo um plano de racionamento elétrico de 30 dias por causa dos blecautes generalizados do último dia 7 de março. Em três semanas, a ",Internacional,Maduro anuncia 30 dias de racionamento de energia na Venezuela,2019-04-01T10:15:54-03:00
O dia a dia de uma cidade em ruínas para além dos bombardeios cotidianos e da violência no território palestino,El País,https://brasil.elpais.com/brasil/2019/03/28/album/1553787288_886314.html,,Internacional,24 horas em Gaza,2019-03-30T11:19:44-03:00
Presidente do Brasil chega neste domingo a Jerusalém sem esclarecer totalmente a incógnita sobre a mudança da embaixada para estreitar sua aliança com Netanyahu e os evangélicos,Naiara Galarraga Gortázar,https://brasil.elpais.com/brasil/2019/03/30/internacional/1553969475_732931.html,O primeiro-ministro israelense foi o convidado mais bem-quisto do presidente do Brasil em sua posse. Agora lhe devolve o gesto com uma visita oficial a Jerusalém que começa no domingo. O intenso idílio político de ,Internacional,O que há por trás do idílio político de Bolsonaro com Israel e Netanyahu,2019-03-30T16:21:31-03:00
O Tribunal de Contas afirmou que o presidente interino fraudou sua declaração de patrimônio e recebeu dinheiro de instâncias internacionais e nacionais sem justificá-lo,Alonso Moleiro,https://brasil.elpais.com/brasil/2019/03/28/internacional/1553794423_260448.html,O regime chavista deu nesta quinta-feira um passo adiante em sua tentativa de asfixiar ,Internacional,Regime de Maduro proíbe Juan Guaidó de ocupar cargos públicos por 15 anos,2019-03-28T15:54:20-03:00
Voto contra força o Reino Unido a decidir em 12 de abril entre uma saída abrupta ou um longo adiamento,Rafa de Miguel,https://brasil.elpais.com/brasil/2019/03/29/internacional/1553856557_119583.html," sofreu sua terceira derrota no Parlamento Britânico. Um total de 344 deputados, contra 286, rejeitou nesta sexta-feira o Acordo de Retirada que a primeira-ministra firmou com a ",Internacional,Parlamento britânico rejeita pela terceira vez o plano de May para o Brexit,2019-03-29T12:40:07-03:00
"Em seu último livro, o influente pensador francês descreve um planeta onde a mudança climática altera tudo",Marc Bassets,https://brasil.elpais.com/brasil/2019/03/29/internacional/1553888812_652680.html,"Bruno Latour (Beaune, 1947) é um dos filósofos franceses mais influentes da atualidade. Acaba de publicar ",Internacional,"Bruno Latour: “O sentimento de perder o mundo, agora, é coletivo”",2019-03-31T10:37:28-03:00
País europeu oferece oficinas por meio de instituições públicas para que as pessoas possam refutar os argumentos simplistas com os quais se deparam diariamente,Ana Carbajosa,https://brasil.elpais.com/brasil/2019/03/29/internacional/1553868997_117300.html,"Às quatro da tarde, cerca de quinze homens e mulheres ocupam seus lugares na sala de aula. Entre eles, há um funcionário de banco, um médico e uma professora. São cidadãos comuns que se inscreveram em um curso para aprender a rebater ",Internacional,Alemanha ensina a rebater o discurso populista do cunhado,2019-04-01T11:34:09-03:00
"Admirador declarado de Bolsonaro, o ator Volodymyr Zelenskiy lidera as pesquisas para as eleições deste domingo explorando a insatisfação popular com a elite política",María R. Sahuquillo,https://brasil.elpais.com/brasil/2019/03/28/internacional/1553803929_078467.html,Volodymyr Zelenskiy já entrou em milhares de lares como presidente da ,Internacional,"Presidente na ficção, humorista é favorito em disputa eleitoral na Ucrânia",2019-03-29T11:18:34-03:00
"Religioso pa’í Oliva, de 90 anos, é um símbolo da luta pelos mais pobres e os direitos sociais",Santi Carneri,https://brasil.elpais.com/brasil/2019/03/29/internacional/1553879369_387868.html,O Senado do ,Internacional,Paraguai homenageia jesuíta espanhol que enfrentou a ditadura de Alfredo Stroessner,2019-03-30T11:56:46-03:00
"Operação, que pretende ajudar 650.000 pessoas, será ""muito semelhante à da Síria"", afirma o presidente da organização internacional",Florantonia Singer,https://brasil.elpais.com/brasil/2019/03/29/internacional/1553881049_406664.html,A ,Internacional,Cruz Vermelha afirma que distribuirá ajuda humanitária na Venezuela em 15 dias,2019-03-30T12:52:29-03:00
Gesto pode ser tido como reconhecimento tácito da soberania israelense nessa parte de Jerusalém.,Lourdes Baeza,https://brasil.elpais.com/brasil/2019/04/01/internacional/1554141781_125242.html,"O presidente do Brasil, ",Internacional,"Em gesto inédito, Bolsonaro visita o Muro das Lamentações com Netanyahu",2019-04-01T19:38:45-03:00
"Governo comunica que o mandatário, que não fala em público há sete anos, abandonará o cargo por motivos de saúde. O presidente do Senado deve convocar eleições em um prazo de 90 dias",Agências,https://brasil.elpais.com/brasil/2019/04/01/internacional/1554135457_564142.html,"O presidente argelino, ",Internacional,Argélia anuncia que Buteflika deixará a presidência antes de 28 de abril,2019-04-01T16:01:54-03:00
Presidente interino é investigado por ter desacatado proibição de deixar o país quando fez uma viagem pela América Latina no fim de fevereiro,Maolis Castro,https://brasil.elpais.com/brasil/2019/04/02/internacional/1554164472_010329.html,O chavismo prepara o terreno para uma eventual emboscada contra ,Internacional,Supremo venezuelano ordena a retirada da imunidade parlamentar de Juan Guaidó,2019-04-02T12:05:33-03:00
"O poder do líder bolivariano na Venezuela se baseia no exército e nas milícias, um corpo de um milhão de pessoas treinadas com vassouras e rifles, que prometem dar suas vidas pela Revolução",Jacobo García,https://brasil.elpais.com/brasil/2019/03/29/internacional/1553824596_128119.html,"Carolina, cabo da milícia, e Carlos, sargento, estão preocupados com uma invasão estrangeira na ",Internacional,"Milícia, o exército popular a serviço de Maduro",2019-03-30T21:36:59-03:00
"Ossadas de homens, mulheres e crianças demonstram as circunstâncias desumanas das primeiras explorações portuguesas pela costa oeste do continente",Vicente G. Olaya,https://brasil.elpais.com/brasil/2019/03/29/cultura/1553848854_810812.html,"A Europa reabriu em 2009 as bocarras dos infernos quando a Prefeitura de Lagos – hoje uma plácida, ensolarada, turística e bela cidade do Algarve português – decidiu construir um estacionamento subterrâneo alguns metros além de suas muralhas medievais, em uma área urbana conhecida como Vale da Gafaria. As escavadoras iniciaram seu trabalho e começaram a brotar dezenas de ossos de seres humanos. Maria Teresa Santos Ferreira, professora de Antropologia da Universidade de Coimbra, foi ao local com sua equipe. Hoje, dez anos depois, os resultados de sua pesquisa foram publicados no ",Cultura,O mistério dos 158 corpos de africanos escravizados jogados num lixão em Portugal,2019-04-02T12:05:34-03:00
"O célebre colégio Stuyvesant se torna também o epicentro da segregação: apenas 7 dos 895 novos alunos para o próximo ano letivo são afro-americanos, enquanto três quartos são asiáticos",Sandro Pozzi,https://brasil.elpais.com/brasil/2019/04/01/internacional/1554147846_545287.html,"A Stuyvesant High School é a grande joia do sistema educacional nova-iorquino, o colégio público aonde famílias com filhos brilhantes, mas sem recursos, aspiram a levar seus filhos. Com fama de ser um universo ultracompetitivo, abre as portas a universidades de elite como Columbia, ",Internacional,Só sete jovens negros no Olimpo da educação pública de Nova York,2019-04-03T10:26:47-03:00
A aplicação da lei islâmica desencadeia campanhas de boicote e condenação internacional,EFE,https://brasil.elpais.com/brasil/2019/04/03/internacional/1554284355_385703.html,"O apedrejamento ou mutilação de membros são punições baseadas na lei islâmica (sharia) que entraram em vigor nesta quarta-feira no Sultanato de Brunei, em meio a campanhas de boicote e condenação por parte da comunidade internacional.",Internacional,Brunei começa a punir com apedrejamento o adultério e a homossexualidade,2019-04-03T13:15:32-03:00
Presidente reage a um escândalo relacionado a crimes de lesa-humanidade cometidos durante a ditadura,Magdalena Martínez,https://brasil.elpais.com/brasil/2019/04/01/internacional/1554141574_437551.html,"O ministro da Defesa do Uruguai, Jorge Menéndez, seu vice-ministro e três generais, entre eles o novo chefe do Exército, José González, foram destituídos nesta segunda-feira pelo presidente ",Internacional,Cúpula militar uruguaia cai após revelação de crimes da ditadura,2019-04-01T23:48:15-03:00
"Lori Lightfoot supera Toni Preckwinkle, também afro-americana, por quase 50 pontos",Yolanda Monge,https://brasil.elpais.com/brasil/2019/04/03/internacional/1554261437_488996.html,"Acompanhada por sua esposa e sua filha, a democrata Lori Lightfoot, mulher negra de 56 anos, declarou sua vitória em ",Internacional,Chicago elege sua primeira prefeita negra e homossexual,2019-04-03T17:11:06-03:00
"Presidente encerrou visita a aliado Netanyahu no Museu do Holocausto e repetiu que nazismo é de esquerda, declaração contrariada inclusive no site oficial do local",Lourdes Baeza,https://brasil.elpais.com/brasil/2019/04/02/internacional/1554216611_825972.html,O presidente ,Internacional,Bolsonaro se despede de Israel com promessas econômicas e gafe sobre nazismo,2019-04-02T21:03:54+02:00
"EL PAÍS localiza, em meio a milhares de famílias jihadistas num campo de acolhida, três mulheres que viajaram com seus maridos para a Síria em 2014 e sobreviveram ao desmoronamento do califado",Natalia Sancha,https://brasil.elpais.com/brasil/2019/04/03/internacional/1554297555_947058.html,"“A única coisa que desejamos é sair daqui. Não podem nos condenar por cuidar da casa e de nossos filhos no Estado Islâmico”, dizem Yolanda Martínez, Luna Fernández e Lubna Miludi. São cidadãs espanholas que viajaram com seus maridos para a Síria em 2014 e sobreviveram ao desmoronamento do califado do ",Internacional,As três espanholas do Estado Islâmico: “Só queremos ir embora”,2019-04-04T12:07:07-03:00
Familiares e amigos de vítimas narram em primeira pessoa as últimas horas com vida de entes queridos,Mar Centenera,https://brasil.elpais.com/brasil/2019/03/29/internacional/1553885143_703482.html,"""Meu nome é Ángel Gerardo Pisarello. É 24 de junho de 1976, e acho que os militares vêm me buscar"", ouve-se num áudio divulgado há duas semanas nas ",Internacional,Vozes recuperadas da ditadura argentina,2019-04-03T19:02:23-03:00
