subTitle,author,url,text,section,title,date
"Assessores do vice-presidente de Obama, candidato óbvio para lutar contra Trump em 2020, afirmam que esses episódios não alteram decisão de aspirar à Casa Branca",Amanda Mars,https://brasil.elpais.com/brasil/2019/04/01/internacional/1554139894_782646.html,A ausência de um nome é cada vez mais estrondosa na longa lista de aspirantes democratas para derrotar ,Internacional,Ambição presidencial de Joe Biden ameaçada por duas acusações de conduta sexual imprópria,2019-04-02T14:57:12-03:00
O país enfrenta uma brutal contração demográfica.,Andrea Rizzi,https://brasil.elpais.com/brasil/2019/03/21/internacional/1553180920_032158.html,"A simpática senhora Fumiko Nakajima, de 85 anos, parece caminhar com serenidade nesse território estranho que é a reta final da vida. Sentada em sua cadeira de rodas como um pássaro em seu ninho no quarto andar do lar de idosos Zenkoukai, em ",Internacional,"Em busca de um equilíbrio entre idosos, imigrantes e robôs no Japão",2019-04-02T20:14:22-03:00
Presidente afirmou de forma imprecisa que estudo do Governo chegou a conclusão que o desenvolvimento intelectual de crianças do programa equivalia a 1/3 da média mundial,F.B.,https://brasil.elpais.com/brasil/2019/03/22/politica/1553210408_972537.html,"Na última terça-feira, o presidente ",Brasil,Bolsonaro e o desenvolvimento dos filhos do Bolsa Família: o que os pesquisadores realmente dizem,2019-03-23T20:51:31-03:00
Promotor e professor de direito se contrapõem na análise técnica sobre a detenção do ex-presidente,Afonso Benites,https://brasil.elpais.com/brasil/2019/03/22/politica/1553288450_214915.html,"Apesar de prevista na legislação penal em apenas três ocasiões, a prisão preventiva sempre gera longas discussões quando envolve figuras públicas, como ",Brasil,Prisão de Temer reacende debate sobre uso de prisão preventiva pela Lava Jato,2019-03-23T12:02:05-03:00
"Símbolo da luta pela visibilidade das indígenas na Bolívia, um grupo de mulheres aimarás acaba de completar seu último desafio: chegar ao cume do Aconcágua, o mais alto da América",Enrique Vaquerizo,https://brasil.elpais.com/brasil/2019/03/22/internacional/1553277982_341963.html,"Lidia Huayllas vem subindo o Huayna Potosí há mais de 25 anos. A montanha, com 6.088 metros de altitude, é uma das mais emblemáticas da ",Internacional,A ascensão imparável das ‘cholitas escaladoras’,2019-04-03T12:33:09-03:00
As causas por trás do bloqueio parlamentar e da guerra interna no Governo de May,Rafa de Miguel,https://brasil.elpais.com/brasil/2019/04/02/internacional/1554203421_336330.html,Há um constrangimento entre os políticos do ,Internacional,Brexit: esses britânicos estão loucos?,2019-04-02T18:10:29-03:00
Votação relâmpago de PEC encerra dia marcado pela ausência de Paulo Guedes em comissão da reforma da Previdência. Senado Bolsonaro usou a manhã para ir ao cinema,Afonso Benites,https://brasil.elpais.com/brasil/2019/03/27/politica/1553642262_663695.html,A terça-feira deveria ter sido o marco dos primeiros passos da ,Brasil,Câmara envia recado indigesto a Bolsonaro antes de analisar Previdência,2019-03-27T15:23:21-03:00
"O espanhol Ángel Hernández atendeu ao desejo da mulher María José e a ajudou a tomar um medicamento letal. “Quero o final o quanto antes”, dizia ela em outubro passado a este jornal",Emilio de Benito,https://brasil.elpais.com/brasil/2019/04/04/internacional/1554365744_092895.html,"Ángel Hernández e María José Carrasco estavam decididos. No dia em que ela assim quisesse, ele a ajudaria a tirar a própria vida. Carrasco sofria de ",Internacional,Idoso é preso por ajudar esposa a fazer eutanásia após 30 anos de luta contra esclerose múltipla,2019-04-04T14:39:50-03:00
Ministro da Economia ia em 'missão de paz' para explicar projeto de reforma na CCJ e tentar atenuar crise entre Governo e Rodrigo Maia. Desistência de Guedes foi criticada,Marina Novaes,https://brasil.elpais.com/brasil/2019/03/26/politica/1553607037_149988.html,"O ministro da Economia, ",Brasil,Paulo Guedes cancela ida à Câmara para defender reforma da Previdência e acirra tensão com o Legislativo,2019-03-26T13:29:31-03:00
Ninguém podia imaginar em 2014 que a operação revelaria o maior escândalo de corrupção da história do Brasil e seria o estopim de mudanças profundas que se materializaram em um presidente de ultradireita e numa oposição irrelevante,Naiara Galarraga Gortázar,https://brasil.elpais.com/brasil/2019/03/24/politica/1553385476_361260.html,"Dois dos sete presidentes que o Brasil teve desde o fim da ditadura dormem atrás das grades, derrotados pelas suspeitas de corrupção. ",Brasil,"A queda de outro ex-presidente do Brasil, a nova fatura da Lava Jato à velha política brasileira",2019-03-24T09:38:53-03:00
"Instituições buscam formas para lidar com ameaças, várias delas já identificadas pelas autoridades policiais como trote de adolescentes",B. J.,https://brasil.elpais.com/brasil/2019/03/21/politica/1553207769_581816.html,Um jovem de 18 anos que se exibia com armas de ,Brasil,A tensão em escolas e universidades na esteira do massacre de Suzano,2019-03-27T17:25:33-03:00
"Para filósofa e matemática, campo progressista deve se opor à reforma da Previdência de Bolsonaro apresentando seu próprio projeto. Defende que a renovação deve vir a partir dos municípios",Felipe Betim,https://brasil.elpais.com/brasil/2019/03/20/politica/1553037448_213932.html, O que você destacaria de positivo e negativo na ,Brasil,"Tatiana Roque: “O problema da esquerda não é a pauta dita identitária, mas sim a lacração”",2019-03-24T19:12:05-03:00
"Com chamado aberto à comemoração do golpe de 1964, presidente dobra sua aposta na polarização política",Afonso Benites,https://brasil.elpais.com/brasil/2019/03/26/politica/1553557825_337887.html,O ,Brasil,A guerra de todos contra todos no Governo Bolsonaro,2019-03-25T23:32:22-03:00
Investidores expressaram cautela em meio a mais um dia de trocas de farpas.,El País,https://brasil.elpais.com/brasil/2019/03/27/politica/1553726237_400761.html,,Brasil,"Bolsonaro X Maia, a trama se adensa enquanto o dólar tem forte alta",2019-03-27T22:51:18-03:00
"Narrador era um dos seis sobreviventes do acidente com o voo da Chape, que matou 71 pessoas em novembro de 2016",Marina Novaes,https://brasil.elpais.com/brasil/2019/03/27/politica/1553649151_721382.html,Morreu na noite desta terça-feira o jornalista ,Brasil,"Morre o jornalista Rafael Henzel, sobrevivente da tragédia com voo da Chapecoense",2019-03-27T00:02:28-03:00
"Decisão é do desembargador Antonio Ivan Athié, do TRF-2, que também mandou soltar o ex-ministro Moreira Franco e outros seis presos na Operação Descontaminação",Felipe Betim,https://brasil.elpais.com/brasil/2019/03/25/politica/1553536554_803335.html," já está fora da cadeia. O desembargador Antonio Ivan Athié, do Tribunal Regional da 2ª Região (TRF-2), revogou na tarde desta segunda-feira a prisão preventiva do ex-presidente da República (MDB), segundo confirmou o próprio tribunal. Temer está detido desde a última quinta-feira, 21 de março, por ordem do juiz federal ",Brasil,Michel Temer deixa a prisão após decisão da Justiça Federal no Rio,2019-03-25T21:14:48-03:00
Linha considerada a espinha dorsal do desenvolvimento logístico do país deve ser leiloada nesta quinta-feira com preço menor do que sugerido pela estatal Valec. Há duas empresas interessadas.,Afonso Benites,https://brasil.elpais.com/brasil/2019/03/28/politica/1553729926_061804.html,O lance mínimo da ,Brasil,"Ferrovia Norte-Sul vale três vezes mais que previsto em edital, aponta estudo",2019-03-28T12:10:19-03:00
"A expectativa de uma visita do presidente Jair Bolsonaro à universidade em São Paulo, cenário emblemático da luta estudantil durante a ditadura, gerou embates inflamados entre estudantes e bolsonaristas",Beatriz Jucá,https://brasil.elpais.com/brasil/2019/03/27/politica/1553717682_889482.html,"Cenário emblemático da luta estudantil em São Paulo durante a ditadura militar, o entorno da Universidade Presbiteriana Mackenzie voltou a ser palco de tensão entre estudantes e militantes na tarde desta quarta-feira. A expectativa de uma visita de ",Brasil,Um Brasil de dedo em riste às portas do Mackenzie,2019-03-28T18:02:37-03:00
"O sistema partidário brasileiro vinha se fortalecendo desde 1994, mas a aparente solidez não foi capaz de dar garantias contra o avanço das forças radicais",Pedro Floriano Ribeiro,https://brasil.elpais.com/brasil/2019/03/25/politica/1553536255_999485.html,"O Governo dos amadores radicais dá seus primeiros passos, ainda cambaleantes, e cada vez mais amparados no andador institucional representado pela facção militar do gabinete. Principalmente em seus núcleos mais ideológicos, e incluindo o clã presidencial, o ",Brasil,Partidos políticos fortes: proteção contra os extremismos?,2019-03-25T16:13:11-03:00
"Em zonas de conflito, há coordenações que funcionam dentro de carros e funcionários que sofrem de esgotamento físico e mental por atuar sozinhos",Ciro Barros (Agência Pública),https://brasil.elpais.com/brasil/2019/03/27/politica/1553700198_051341.html,"Nos últimos anos, a ",Brasil,"Operando com 10% do orçamento, Funai abandona postos e coordenações em áreas indígenas",2019-03-27T15:21:41-03:00
Pesquisador inglês Jamie Bartlett chama atenção para a cidadania na Internet:,Ethel Rudnitzki (Agência Pública),https://brasil.elpais.com/brasil/2019/03/26/politica/1553628705_921854.html,"“Fomos muito ingênuos”, adverte o pesquisador e jornalista inglês Jamie Bartlett. Para ele, nos primórdios da ",Brasil,“Refletir sobre nosso comportamento online é mais importante do que votar”,2019-03-26T18:09:22-03:00
Massacre de Suzano reabre debate sobre papel das instituições de ensino em identificar transtornos psiquiátricos. 80% dos alunos da rede pública com algum problema não recebem tratamento,Beatriz Jucá,https://brasil.elpais.com/brasil/2019/03/18/politica/1552928918_526670.html,"Duas semanas após o massacre de Suzano, investigadores ainda se debruçam sobre um ",Brasil,"Saúde mental dos estudantes, mais um desafio para as escolas brasileiras",2019-03-27T18:01:31-03:00
"Liminar havia sido concedida na sexta-feira a noite, mas menos de 24 horas depois foi derrubada",Marina Rossi,https://brasil.elpais.com/brasil/2019/03/30/politica/1553963400_195148.html,Menos de 24 horas depois de a juíza federal Ivani Silva da Luz ,Brasil,Justiça suspende decisão que proibia Forças Armadas de celebrarem golpe de 1964,2019-03-30T16:17:59-03:00
"Bolsa caiu 3,6% nesta quarta-feira diante das dúvidas cada vez maiores sobre a reforma da previdência e constantes polêmicas do Governo brasileiro",Naiara Galarraga Gortázar,https://brasil.elpais.com/brasil/2019/03/28/politica/1553783247_132819.html,As enormes expectativas que acompanharam a sólida vitória eleitoral de ,Brasil,Desconfiança dos investidores com Bolsonaro cresce e dólar supera 4 reais,2019-03-28T22:10:53-03:00
Historiador diz que as Forças Armadas nunca reconheceram os aspectos mais negativos do regime militar e que não havia ameaça imediata de implantação de um regime comunista,Thiago Domenici (Agência Pública),https://brasil.elpais.com/brasil/2019/03/30/politica/1553984610_147330.html,"O historiador e cientista político Boris Fausto, 88 anos, é autor de estudos clássicos sobre a história do ",Brasil,Boris Fausto e o golpe de 64: “É impossível ir contra fatos estabelecidos”,2019-03-31T14:13:20-03:00
"Para diretor da Ação Educativa, pautas reais vêm sendo abandonadas por questões ideológicas.",Ciro Barros (Agência Pública),https://brasil.elpais.com/brasil/2019/03/28/politica/1553797049_828899.html,"“A gente está vendo a corrosão geral das políticas estabelecidas”. Assim Roberto Catelli, coordenador executivo adjunto da ONG Ação Educativa — que desde 1994 trabalha com educação —, define os primeiros meses da ",Brasil,“A gente está vendo a corrosão geral das políticas estabelecidas no MEC”,2019-03-28T16:57:15-03:00
"Procurador do caso Herzog que acobertou torturadores e pediu pena de morte para militantes, Durval Ayrton Moura de Araújo, de 99 anos, conversa com o EL PAÍS",Gil Alessi,https://brasil.elpais.com/brasil/2019/03/28/politica/1553789942_315053.html,"O procurador da Justiça Militar aposentado Durval Ayrton Moura de Araújo, de 99 anos, se considera um homem de fé. A imponente capela localizada logo na entrada de sua casa, com ",Brasil,“Não me arrependo de nada”,2019-03-28T21:52:14-03:00
"Com medida simbólica, presidente determinou que Forças Armadas façam ""comemorações devidas"" da data",Gil Alessi,https://brasil.elpais.com/brasil/2019/03/26/politica/1553609505_570456.html,"Agora, com número recorde de militares ocupando o primeiro escalão do Governo desde os anos de chumbo, Bolsonaro faz um aceno considerado por especialistas ""mais simbólico do que prático"" para a ala mais radical da tropa, conhecida como ",Brasil,Bolsonaro escancara cadáver insepulto da ditadura com celebração do golpe,2019-03-26T17:51:54-03:00
"Aloy Jupiara, coautor de 'Os porões da contravenção', fala sobre o legado de profissionalização do crime deixado pelos anos de chumbo que perdura até hoje",Felipe Betim,https://brasil.elpais.com/brasil/2019/03/29/politica/1553885098_115676.html,"Trajetória similar tiveram outros vários agentes públicos da ditadura militar brasileira (1964-1985). Como o capitão do Exército Aílton Guimarães Jorge, o coronel do Exército Paulo Malhães, o policial civil Luiz Cláudio de Azeredo Vianna ou o delegado Mauro Fernando de Magalhães, alguns dos personagens do livro ",Brasil,“Lógica de usar torturadores da ditadura no crime foi usada nas milícias”,2019-04-01T13:22:17-03:00
"Neófita no Congresso, Tabata Amaral (PDT-SP) sugere que Ricardo Vélez se demita do MEC, o deixa em silêncio, e agrava ainda mais a situação do ministro olavista de Bolsonaro",Marina Rossi,https://brasil.elpais.com/brasil/2019/03/28/politica/1553801628_869241.html,"Hoje participei de uma reunião com o Ministro Ricardo Veléz na Comissão de Educação. Insistentemente o questionei sobre quais eram os projetos e metas para melhorar a qualidade da educação no Brasil, mas não obtive resposta. ",Brasil,A jovem deputada que jogou contra as cordas o ministro da Educação e sua “lista de desejos”,2019-03-29T12:43:17-03:00
"Valor da outorga foi de 2,7 bilhões, o que representa um ágio de 100,92%. A quantia, porém, é inferior ao que um estudo apontava que deveria ser pago pela concessão",Afonso Benites,https://brasil.elpais.com/brasil/2019/03/28/politica/1553800398_822136.html,O ,Brasil,"Rumo, do grupo Cosan, vence disputa pela ferrovia Norte-Sul",2019-03-28T18:01:06-03:00
"A Operação Condor, aliança entre Brasil, Argentina, Chile, Uruguai, Paraguai e Bolívia, permitiu a troca de informações e livre trânsito para perseguir, torturar e matar opositores da ditadura no continente",Marina Rossi,https://brasil.elpais.com/brasil/2019/03/29/politica/1553895462_193096.html,"Na época do sequestro, a Condor era uma aliança secreta formada entre os governos militares do Brasil, Argentina, Bolívia, Paraguai, Chile e Uruguai para perseguir os ativistas contra os regimes militares nesses países. Embora formalizada somente em 25 de novembro de 1975, em Santiago do Chile, essa conexão repressiva já existia desde o início daquela década no continente. O jornalista Luiz Cláudio Cunha, que juntamente com o fotógrafo J.B. Scalco, descobriu o sequestro da família, conta que o caso foi a primeira ação da Condor em território brasileiro. “Até então, não havia nenhuma informação sobre a Condor ter entrado no Brasil”, conta ele, que também é autor do livro ",Brasil,"A regra de sangue da Operação Condor, a aliança mortífera das ditaduras do Cone Sul",2019-03-30T10:02:26-03:00
Piñera já fez vários gestos de rejeição ao passado do regime que matou mais de 3.000 chilenos. O legado econômico da ditadura também é contestado pela sociedade que cobra Educação e Previdência com ajuda do Governo,Federico Rivas Molina,https://brasil.elpais.com/brasil/2019/03/31/internacional/1554043377_971837.html,"Nos arredores da Escola Militar, em Santiago, milhares de pessoas faziam fila para cruzar o portão de entrada. A cena foi impactante. A multidão não queria perder de vista o caixão que, envolto na bandeira do Chile, abrigava os restos mortais de ",Internacional,"No Chile, a política repudia a figura de Pinochet e matiza seu legado econômico",2019-03-31T14:16:20-03:00
Prefeito é denunciado por crime de responsabilidade por supostas irregularidades na renovação de contratos urbanos em 2018,Felipe Betim,https://brasil.elpais.com/brasil/2019/04/02/politica/1554238276_248892.html,A Câmara dos Vereadores do ,Brasil,Câmara do Rio abre processo de impeachment contra Crivella,2019-04-02T19:28:19-03:00
"Ministro, governador e deputada costuraram a trégua entre presidente e Rodrigo Maia, mas há dúvidas sobre a permanência do armistício",Afonso Benites,https://brasil.elpais.com/brasil/2019/03/29/politica/1553892850_850890.html,"Após quase duas semanas de ataques verbais, os presidentes da República, ",Brasil,O passo atrás de Bolsonaro no enfrentamento contra Maia,2019-03-30T00:08:46-03:00
"Desemprego no Brasil aumenta e 13,1 milhões de brasileiros estão em busca de um trabalho. Em São Paulo, Mutirão de Emprego atrai 15.000 pessoas e milhares chegam a dormir na fila para deixar o currículo e conseguir uma entrevista de emprego",Diogo Magri,https://brasil.elpais.com/brasil/2019/04/02/politica/1554156937_233006.html,"""Aceito qualquer coisa"". A frase era recorrente entre os candidatos que passaram horas na fila para obter ao menos uma entrevista de trabalho no Mutirão do Emprego, que atraiu 15.000 pessoas interessadas nas 8.000 vagas com carteira assinada oferecidas pelo evento em ",Brasil,14 horas numa fila por um emprego: “As contas e a barriga não esperam”,2019-04-03T15:24:42-03:00
"“Roubaram minha identidade”, diz Rosângela Paraná, cuja certidão de nascimento foi forjada pelo avô sargento.",Joana Oliveira,https://brasil.elpais.com/brasil/2019/03/29/politica/1553877780_122371.html,"Rosângela Serra Paraná não sabe quantos anos tem ou onde nasceu. Sua certidão de nascimento, registrada em 1967 no Catete (Rio de Janeiro) e datada em 1º de outubro de 1963, é falsa. A maternidade no número 160 da Rua Marquês de Abrantes, no Flamengo, nunca existiu: o prédio pertence à autarquia de previdência dos servidores públicos desde 1958. O documento foi forjado pelo seu ""avô"", o sargento do Exército Arcy de Paiva Paraná, que, assim que ela nasceu, tirou-a dos braços de sua mãe ""prostituta"" e entregou-a ao filho —o também militar Odyr de Paiva Paraná— e à nora, Nilza Serra Paraná, que não podia gerar crianças. É essa a história da sua vida, que ela só foi conhecer em 2013.",Brasil,"Rosângela, uma das crianças sequestradas por famílias de militares na ditadura",2019-03-30T22:21:08-03:00
A decisão da juíza que proíbe as Forças Armadas de celebrarem golpe de 1964 contrapõe texto de militares ao de Ulysses Guimarães na Constituinte. Gilmar Mendes rejeita análise do tema,F. M.,https://brasil.elpais.com/brasil/2019/03/26/politica/1553638410_317117.html,"A juíza federal Ivani Silva da Luz, de Brasília, proibiu em caráter liminar nesta sexta-feira as Forças Armadas de comemorarem, especialmente com uso de dinheiro público, o 55º aniversário do golpe de Estado que em 1964 instaurou a ditadura militar no Brasil. ",Brasil,"“A sociedade foi Rubens Paiva, não os facínoras que o mataram”",2019-03-30T00:11:08-03:00
"Após mais de 48 horas de silêncio, Osmar Stábile diz ter pago produto. Planalto repete que não se pronunciará sobre a veiculação do material em canal oficial",Marina Rossi,https://brasil.elpais.com/brasil/2019/04/02/politica/1554241102_323727.html,Mais de 48 horas após o silêncio diante da veiculação de um ,Brasil,Empresário assume financiamento de vídeo pró-golpe veiculado por Governo,2019-04-02T21:31:07-03:00
"Ação aconteceu quando grupo de 25 suspeitos realizaria roubo a duas agências bancárias. À Rádio Bandeirantes, Governador João Doria comemora: ""colocaram no cemitério mais 10 bandidos""",Arthur Stabile e Maria Teresa Cruz (Ponte),https://brasil.elpais.com/brasil/2019/04/04/politica/1554400675_265970.html,"Uma ação da Rota, a tropa de elite da ",Brasil,"Rota mata 11 pessoas em Guararema, na terceira ação policial mais violenta da história de SP",2019-04-04T15:45:44-03:00
"Chamado de ‘tchutchuca’ pelo petista Zeca Dirceu, ministro da Economia cai na provocação e sessão da CCJ acaba com bate boca depois de quase sete horas de discussão",Afonso Benites,https://brasil.elpais.com/brasil/2019/04/03/politica/1554328445_166119.html,A esperada ida do ,Brasil,Um solitário Paulo Guedes esgrima com a oposição pela reforma da Previdência,2019-04-03T22:53:50-03:00
"Autoridade Palestina convoca embaixador no Brasil para consultas. Em visita ao Muro das Lamentações, presidente diz que palestinos têm o “direito de reclamar""",Juan Carlos Sanz,https://brasil.elpais.com/brasil/2019/03/31/politica/1554060705_325198.html,A devoção dos cristãos evangélicos em seu apoio incondicional ao ,Brasil,"Bolsonaro troca embaixada por escritório em Jerusalém, mas não evita retaliação palestina",2019-04-01T12:26:32-03:00
Presidente anuncia espaço para promoção comercial na cidade que tem peso estratégico para o Governo de Benjamin Netanyahu. Israel anuncia “forte apoio” à entrada do Brasil na OCDE,Agências,https://brasil.elpais.com/brasil/2019/03/31/politica/1554043546_030838.html,O presidente ,Brasil,"Após acenar com embaixada, Bolsonaro anuncia escritório comercial em Jerusalém",2019-03-31T17:08:00-03:00
"Marcha em São Paulo reuniu milhares de pessoas neste domingo, enquanto dez capitais se mobilizaram com ações simbólicas pelos mortos no regime. Whatsapp do Planalto divulga vídeo com defesa do golpe",Carla Jiménez,https://brasil.elpais.com/brasil/2019/04/01/politica/1554080218_534308.html,"“Isto aqui é uma psicanálise coletiva”, diz Adriano Diogo, de 70 anos, sentado num banco em frente à entrada da 36º Distrito Policial da Vila Mariana, zona sul de São Paulo. Quando Diogo tinha 23 anos, ele ficou preso nesse mesmo endereço, nos prédios do ",Brasil,Atos por memória das vítimas da ditadura se multiplicam em revés a revisionismo de Bolsonaro,2019-04-01T00:21:05-03:00
"Uma semana após cancelar ida à Comissão de Constituição e Justiça, ministro da Economia confirma participação em audiência prevista para às 14h desta quarta-feira",El País,https://brasil.elpais.com/brasil/2019/04/03/politica/1554306984_314990.html,Se não ,Brasil,Paulo Guedes defende sua reforma da Previdência em audiência na Câmara,2019-04-03T14:41:39-03:00
"“É preciso saber se foi pago com recursos públicos”, diz Gil Castello Branco, do Contas Abertas. Ao 'Globo', ator disse ter sido pago. Mourão disse que ideia foi de Bolsonaro",Marina Rossi,https://brasil.elpais.com/brasil/2019/04/01/politica/1554151562_942843.html,"No último domingo, enquanto militantes a favor e contra a ditadura militar ",Brasil,Quem pagou pelo vídeo revisionista da ditadura distribuído pelo Governo Bolsonaro?,2019-04-02T10:59:05-03:00
"Em entrevista ao 'Valor', Ricardo Vélez, da Educação, diz que não ocorreu um golpe em 1964",El País,https://brasil.elpais.com/brasil/2019/04/04/politica/1554334968_202816.html,"O ministro da Educação, Ricardo Vélez, segue encampando a agenda mais ideológica do ",Brasil,Ministro promete mudar livros didáticos por “visão mais ampla” da ditadura,2019-04-03T21:57:47-03:00
"Um mês depois da morte, laudo de exames realizados pelo Instituto Adolfo Lutz descartam todos os tipos de meningite como causa do óbito de Arthur Araújo Lula da Silva, de 7 anos",El País,https://brasil.elpais.com/brasil/2019/04/02/politica/1554238552_750714.html,O laudo de exames feitos em ,Brasil,Neto de Lula não morreu de meningite,2019-04-04T16:23:01-03:00
"Grupos se atacaram com paus de bandeira, socos e chutes na avenida Paulista neste domingo",Daniel Arroyo e Maria Teresa Cruz (Ponte),https://brasil.elpais.com/brasil/2019/04/01/politica/1554118634_296372.html,"“Putas feministas”, gritava descontroladamente a ativista Isabella Trevisani, 22 anos, na calçada da Avenida Paulista, região central de ",Brasil,Atos pró e contra ditadura militar terminam em confrontos em São Paulo,2019-04-01T10:32:14-03:00
"Revelado pelo São Paulo, o versátil defensor foi comprado do Porto por 50 milhões de euros e chega ao fim da temporada",Pablo Pérez,https://brasil.elpais.com/brasil/2019/03/14/deportes/1552561571_389016.html,", 1998, tornou-se o novo jogador do ",Esportes,"Eder Militão, o zagueiro mais caro da história do Real Madrid e primeiro reforço de Zidane",2019-03-15T11:16:27-03:00
"Ajax x Juventus, Liverpool x Porto e Tottenham x Manchester City são os outros confrontos. Sorteio também definiu chaveamento até a final",Diogo Magri,https://brasil.elpais.com/brasil/2019/03/14/deportes/1552585179_394268.html,O ,Esportes,Sorteio coloca Manchester United contra o Barcelona nas quartas da Champions League,2019-03-15T11:31:19-03:00
